<?xml version="1.0" encoding="UTF-8"?>
<device xmlns="http://public.sns.gov/schema/device.xsd"
    xmlns:xsi="http://www.w3.org/2001/XMLSchema-instance"
    xsi:schemaLocation="http://public.sns.gov/schema/device.xsd http://public.sns.gov/schema/device.xsd">
    <device_name>a2r_motor</device_name>
    <device_description>One of the four motors for Slit 2. Based on HYSPEC motorsConfigFile.xml, motorsOptionsFile.xml, and motorsUnitsFile.xml.</device_description>
    <app_id>1031</app_id>
    <enumerations>
      <enumeration>
        <enum_name>enum_51</enum_name>
        <!-- Motor status enumeration. Repeat in each and every motor's descriptor.-->
        <enum_element>
            <enum_element_name>UNKNOWN</enum_element_name>
            <enum_element_value>0</enum_element_value>
        </enum_element> 
        <enum_element>
            <enum_element_name>ACTIONREQ</enum_element_name>
            <enum_element_value>1</enum_element_value>
        </enum_element> 
        <enum_element>
            <enum_element_name>MOVING</enum_element_name>
            <enum_element_value>2</enum_element_value>
        </enum_element> 
        <enum_element>
            <enum_element_name>ATPOSITION</enum_element_name>
            <enum_element_value>3</enum_element_value>
        </enum_element> 
        <enum_element>
            <enum_element_name>OFFTARGET</enum_element_name>
            <enum_element_value>4</enum_element_value>
        </enum_element> 
        <enum_element>
            <enum_element_name>POSLIM</enum_element_name>
            <enum_element_value>5</enum_element_value>
        </enum_element> 
        <enum_element>
            <enum_element_name>NEGLIM</enum_element_name>
            <enum_element_value>6</enum_element_value>
        </enum_element> 
        <enum_element>
            <enum_element_name>PROBSTOP</enum_element_name>
            <enum_element_value>7</enum_element_value>
        </enum_element> 
        <enum_element>
            <enum_element_name>ABORTED</enum_element_name>
            <enum_element_value>8</enum_element_value>
        </enum_element> 
        <enum_element>
            <enum_element_name>OVERRIDDEN</enum_element_name>
            <enum_element_value>9</enum_element_value>
        </enum_element> 
        <enum_element>
            <enum_element_name>VETOED</enum_element_name>
            <enum_element_value>10</enum_element_value>
        </enum_element> 
        <enum_element>
            <enum_element_name>COMERR</enum_element_name>
            <enum_element_value>11</enum_element_value>
        </enum_element> 
        <enum_element>
            <enum_element_name>DRVERR</enum_element_name>
            <enum_element_value>12</enum_element_value>
        </enum_element> 
        <enum_element>
            <enum_element_name>REQERR</enum_element_name>
            <enum_element_value>13</enum_element_value>
        </enum_element> 
        <enum_element>
            <enum_element_name>MOVEERR</enum_element_name>
            <enum_element_value>14</enum_element_value>
        </enum_element>
      </enumeration> 
    </enumerations>        
    <process_variables>
      <process_variable>
          <pv_name>a2r</pv_name>
          <pv_id>0</pv_id>
          <pv_nids_read>dstp://motors/Position[5]</pv_nids_read>
          <pv_type>double</pv_type>
          <pv_units>millimetre</pv_units>
          <pv_hint>
              <pv_nexus_link>/NXroot/NXinstrument/NXaperture[@name="aperture2"]/a2r</pv_nexus_link>
              <pv_nexus_type>NXpositioner</pv_nexus_type>              
          </pv_hint>   
      </process_variable>
        <process_variable>
            <pv_name>a2rRequest</pv_name>
            <pv_id>1</pv_id>
            <pv_nids_read>dstp://motors/Request[5]</pv_nids_read>
            <pv_nids_write>dstp://motors/RequestRem[5]</pv_nids_write>
            <pv_type>double</pv_type>
            <pv_units>millimetre</pv_units>
            <pv_hint>
                <pv_nexus_type>NXpositioner</pv_nexus_type>              
            </pv_hint>   
        </process_variable>
        <process_variable>
            <pv_name>a2rStatus</pv_name>
            <pv_id>2</pv_id>
            <pv_nids_read>dstp://motors/RStatus[5]</pv_nids_read>
            <pv_type>enum_51</pv_type>
            <pv_hint>
                <pv_nexus_type>NXpositioner</pv_nexus_type>              
            </pv_hint> 
        </process_variable>      
    </process_variables>
    <serial_number>200E</serial_number>
</device>