<?xml version="1.0" encoding="UTF-8"?>
<device xmlns="http://public.sns.gov/schema/device.xsd"
    xmlns:xsi="http://www.w3.org/2001/XMLSchema-instance"
    xsi:schemaLocation="http://public.sns.gov/schema/device.xsd http://public.sns.gov/schema/device.xsd">
    <device_name>VirtualDevice0</device_name>
    <device_description>Virtual device for sharing enumerations and other useful information across devices.</device_description>
    <enumerations>
        <enumeration>
            <enum_name>enum_00</enum_name>
            <!-- PV status enumeration, see design doc Table 7.-->
            <enum_element>
                <enum_element_name>None</enum_element_name>
                <enum_element_value>0</enum_element_value>
            </enum_element>
            <enum_element>
                <enum_element_name>Read</enum_element_name>
                <enum_element_value>1</enum_element_value>
            </enum_element>
            <enum_element>
                <enum_element_name>Write</enum_element_name>
                <enum_element_value>2</enum_element_value>
            </enum_element>
            <enum_element>
                <enum_element_name>HiHi</enum_element_name>
                <enum_element_value>3</enum_element_value>
            </enum_element>
            <enum_element>
                <enum_element_name>High</enum_element_name>
                <enum_element_value>4</enum_element_value>
            </enum_element>
            <enum_element>
                <enum_element_name>LoLo</enum_element_name>
                <enum_element_value>5</enum_element_value>
            </enum_element>
            <enum_element>
                <enum_element_name>Low</enum_element_name>
                <enum_element_value>6</enum_element_value>
            </enum_element>
            <enum_element>
                <enum_element_name>State</enum_element_name>
                <enum_element_value>7</enum_element_value>
            </enum_element>
            <enum_element>
                <enum_element_name>Cos</enum_element_name>
                <enum_element_value>8</enum_element_value>
            </enum_element>
            <enum_element>
                <enum_element_name>Comm</enum_element_name>
                <enum_element_value>9</enum_element_value>
            </enum_element>
            <enum_element>
                <enum_element_name>Timeout</enum_element_name>
                <enum_element_value>10</enum_element_value>
            </enum_element>
            <enum_element>
                <enum_element_name>HwLimit</enum_element_name>
                <enum_element_value>11</enum_element_value>
            </enum_element>
            <enum_element>
                <enum_element_name>Calc</enum_element_name>
                <enum_element_value>12</enum_element_value>
            </enum_element>
            <enum_element>
                <enum_element_name>Scan</enum_element_name>
                <enum_element_value>13</enum_element_value>
            </enum_element>
            <enum_element>
                <enum_element_name>Link</enum_element_name>
                <enum_element_value>14</enum_element_value>
            </enum_element>
            <enum_element>
                <enum_element_name>Soft</enum_element_name>
                <enum_element_value>15</enum_element_value>
            </enum_element>
            <enum_element>
                <enum_element_name>BadSub</enum_element_name>
                <enum_element_value>16</enum_element_value>
            </enum_element>
            <enum_element>
                <enum_element_name>UDF</enum_element_name>
                <enum_element_value>17</enum_element_value>
            </enum_element>
            <enum_element>
                <enum_element_name>Disable</enum_element_name>
                <enum_element_value>18</enum_element_value>
            </enum_element>
            <enum_element>
                <enum_element_name>Simm</enum_element_name>
                <enum_element_value>19</enum_element_value>
            </enum_element>
            <enum_element>
                <enum_element_name>ReadAccess</enum_element_name>
                <enum_element_value>20</enum_element_value>
            </enum_element>
            <enum_element>
                <enum_element_name>WriteAccess</enum_element_name>
                <enum_element_value>21</enum_element_value>
            </enum_element>
        </enumeration>
        <enumeration>
            <enum_name>enum_01</enum_name>
            <!-- PV alarm severity enumeration, see design doc Table 8.-->
            <enum_element>
                <enum_element_name>No Alarm</enum_element_name>
                <enum_element_value>0</enum_element_value>
            </enum_element> 
            <enum_element>
                <enum_element_name>Minor</enum_element_name>
                <enum_element_value>1</enum_element_value>
            </enum_element>
            <enum_element>
                <enum_element_name>Major</enum_element_name>
                <enum_element_value>2</enum_element_value>
            </enum_element>
            <enum_element>
                <enum_element_name>Invalid</enum_element_name>
                <enum_element_value>3</enum_element_value>
            </enum_element>
        </enumeration>
    </enumerations>       
    <process_variables>
        <process_variable>
            <pv_name>num_active_devices</pv_name>
            <pv_id>0</pv_id>
            <pv_description>Total number of active devices for a run</pv_description>
            <pv_type>unsigned integer</pv_type>
            <pv_min_value>0</pv_min_value>         
        </process_variable>
     </process_variables>
</device>
    